{
  "implementation_id": "IMP-BUG-0001",
  "requirement_id": null,
  "bug_id": "BUG-0001",
  "source_inbox_id": "GH-ISSUE-5",
  "source_issue_number": 5,
  "implementation_issue_number": null,
  "implementation_issue_url": null,
  "copilot_assignment": {},
  "branch": null,
  "pull_request_number": null,
  "pull_request_url": null,
  "status": "QUEUED",
  "created_at": "2026-09-02T16:59:01Z",
  "attempt_count": 0,
  "last_ci_result": "UNKNOWN",
  "validation_state": "PENDING",
  "acceptance_test_ids": [],
  "ci_failures": [],
  "updated_at": "2026-09-02T16:59:01Z"
}
