{
  "implementation_id": "IMP-REQ-0003",
  "requirement_id": "REQ-0003",
  "bug_id": null,
  "source_inbox_id": "INBOX-GH-000006",
  "source_issue_number": 6,
  "implementation_issue_number": 7,
  "implementation_issue_url": "https://github.com/rafalbragan/-LibreDisplay/issues/7",
  "copilot_assignment": {
    "status": "ASSIGNMENT_FAILED",
    "error": "Copilot assignee was not confirmed after GraphQL mutation; mutation_assignees=['Copilot'], issue_assignees=['Copilot']"
  },
  "branch": "fix/librecare-product-foundation-pr-tracking-safety",
  "pull_request_number": 21,
  "pull_request_url": "https://github.com/rafalbragan/-LibreDisplay/pull/21",
  "status": "READY_FOR_HUMAN_REVIEW",
  "created_at": "2026-09-07T12:42:07Z",
  "attempt_count": 0,
  "last_ci_result": "UNKNOWN",
  "validation_state": "PENDING",
  "acceptance_test_ids": [],
  "ci_failures": [],
  "updated_at": "2026-09-07T12:42:07Z"
}
