{
  "implementation_id": "IMP-BUG-0003",
  "requirement_id": null,
  "bug_id": "BUG-0003",
  "source_inbox_id": null,
  "source_issue_number": null,
  "implementation_issue_number": 9,
  "implementation_issue_url": "https://github.com/rafalbragan/-LibreDisplay/issues/9",
  "copilot_assignment": {
    "status": "ASSIGNMENT_FAILED",
    "error": "Copilot assignee was not confirmed after GraphQL mutation; mutation_assignees=['Copilot'], issue_assignees=['Copilot']"
  },
  "branch": null,
  "pull_request_number": null,
  "pull_request_url": null,
  "status": "QUEUED",
  "created_at": "2026-09-03T14:21:44Z",
  "attempt_count": 0,
  "last_ci_result": "UNKNOWN",
  "validation_state": "PENDING",
  "acceptance_test_ids": [
    "DashboardUiLogicTest.kt::formatTrendRatePerMinute_roundsToOneDecimalWithSign (istnieje, obecnie nie kompiluje się z powodu brakującej implementacji)",
    "DashboardUiLogicTest.kt::formatTrendRatePerMinute_roundsToOneDecimalWithSign — istnieje, obecnie nie kompiluje się z powodu brakującej implementacji formatTrendRatePerMinute w DashboardUiLogic.kt",
    "DashboardUiLogicTest.kt::trendWindowSnapshot_returnsNullForZeroMinuteSpan (istnieje, powiązany test logiki trendu)",
    "DashboardUiLogicTest.kt::trendWindowSnapshot_returnsNullForZeroMinuteSpan — istnieje, powiązany test logiki trendu, weryfikuje osobną, już zaimplementowaną funkcję (nie jest bezpośrednio dotknięty, ale w tym samym pliku/module co brakujące funkcje)",
    "Pobranie i analiza artefaktu 'gradle-reports'/'gradle-debug.log' z run_id=33696123982 jako warunek wstępny dalszej klasyfikacji",
    "TEST-BUILD-002: test/skrypt weryfikujący, że wykluczenia AbstractCompile (data/api/v2, data/api/v3) nie wpływają na kompilację innych modułów",
    "TEST-BUILD-002: test/skrypt weryfikujący, że wykluczenia AbstractCompile (data/api/v2, data/api/v3) nie wpływają na kompilację innych modułów — potwierdzone jako niezwiązane z tą awarią, ale wart utrzymania jako regression guard",
    "TEST-CI-SMOKE-001: automatyczny test 'gradlew assembleDebug' jako gate w PR (już częściowo istnieje w workflow)",
    "TEST-CI-SMOKE-001: gradlew assembleDebug jako gate w PR (już częściowo istnieje w workflow) — musi zostać rozszerzony, by blokował merge do master przy błędzie kompilacji",
    "TEST-CI-SMOKE-001: gradlew assembleDebug jako gate w PR — musi zostać rozszerzony/wyegzekwowany jako wymagany status check blokujący merge do master, ponieważ ten regres przeszedł niezauważony przez co najmniej dwa commity na master",
    "TEST-TREND-PROJECTION-001 (do utworzenia): test jednostkowy dla nowej implementacji buildTrendProjection/TrendProjectionThresholds w DashboardUiLogic.kt lub nowym pliku, potwierdzający zgodność z oczekiwaniami DashboardUiLogicTest.kt",
    "TEST-TREND-PROJECTION-001 (do utworzenia): test jednostkowy dla nowej implementacji buildTrendProjection/TrendProjectionThresholds/formatTrendProjectionMessage w DashboardUiLogic.kt, potwierdzający zgodność z sygnaturami już używanymi w RedesignedGlucoseCard.kt (linie 61-70)",
    "TEST-UI-MONITORING-001 (do utworzenia): test Compose/parametryczny potwierdzający, że wszystkie wywołania RedesignedCurrentGlucoseCard w MonitoringScreen.kt (linie 307, 375) przekazują poprawną wartość trendWindowMinutes = state.settings.trendWindowMinutes",
    "TEST-UI-MONITORING-001 (do utworzenia): test Compose/parametryczny potwierdzający, że wszystkie wywołania RedesignedCurrentGlucoseCard w MonitoringScreen.kt przekazują poprawną wartość trendWindowMinutes ze state.settings",
    "TEST-UI-MONITORING-001: test Compose potwierdzający, że każde wywołanie RedesignedCurrentGlucoseCard w MonitoringScreen.kt (portrait i landscape) przekazuje trendWindowMinutes = state.settings.trendWindowMinutes",
    "TEST-TREND-PROJECTION-001: test jednostkowy dla buildTrendProjection/TrendProjectionThresholds w DashboardUiLogic.kt, potwierdzający zgodność sygnatur z użyciem w RedesignedGlucoseCard.kt",
    "DashboardUiLogicTest.kt::formatTrendRatePerMinute_roundsToOneDecimalWithSign",
    "DashboardUiLogicTest.kt::trendWindowSnapshot_returnsNullForZeroMinuteSpan",
    "TEST-CI-SMOKE-001: gradlew assembleDebug jako wymagany (required) status check blokujący merge do master"
  ],
  "ci_failures": [],
  "updated_at": "2026-09-03T14:21:44Z"
}
